{
  "meta": {
    "tema": "mineria",
    "titulo": "El subsuelo y la crisis",
    "subtitulo": "Reservas minerales de Cuba y la ruptura geopolítica de 2026",
    "fuente": "USGS · Sherritt NI 43-101 · Antilles Gold JORC · GeoMinera · MINEM Cuba",
    "periodo": "2019-2026",
    "actualizado": "2026-06-28",
    "nota": "Valor in-situ = metal contenido bruto a precio spot. No descuenta recuperación, costos, regalías ni tiempo. No es valor recuperable ni VAN."
  },
  "kpis": [
    { "id": "valor_ni_co",  "label": "Valor in-situ Ni-Co",   "valor": "~121.500 M USD", "sub": "reservas nacionales · spot jun-2026",             "confianza": "media" },
    { "id": "reservas_ni",  "label": "Reservas de níquel",    "valor": "~5,5 Mt",         "sub": "≈ 6 % de las reservas mundiales (USGS 2024)",       "confianza": "media" },
    { "id": "rango_co",     "label": "Cobalto mundial",        "valor": "# 3 global",      "sub": "~500.000 t — empata con Indonesia (USGS)",           "confianza": "alta" },
    { "id": "prod_2025",    "label": "Producción Ni en 2025",  "valor": "~25.240 t",       "sub": "caída del 48 % desde el pico de 2020 (49.700 t)",    "confianza": "alta" },
    { "id": "oportunidad",  "label": "Coste de oportunidad",   "valor": "< 0,5 % / año",   "sub": "fracción de reservas que Cuba monetiza anualmente", "confianza": "media" }
  ],
  "alertaGeopolitica": {
    "activa": true,
    "items": [
      "8 may 2026 — EE.UU. sanciona Moa Nickel S.A. (secretario de Estado Marco Rubio, Foreign Narcotics Kingpin Act)",
      "22 jun 2026 — Sherritt inicia cierre de Fort Saskatchewan: única fuente de cobalto refinado de Canadá",
      "mar-abr 2026 — Rusia anuncia paquete bilateral de inversión minera >1.000 M USD",
      "2026 — Xinhai Mining (China) avanza en el proyecto La Demajagua (Isla de la Juventud)"
    ]
  },
  "fajaAurifera": {
    "titulo": "La faja aurífera de los ~400 km",
    "descripcion": "La mineralización aurífera cubana se concentra en una franja de unos 400 km desde el sur de Santa Clara (Villa Clara) hasta el norte de Holguín, extendiéndose hacia Las Tunas y Camagüey. Dos familias geológicas dominan: las listvenitas (oro en zonas de alteración metasomática de rocas ofiolíticas ultrabásicas) en el centro de la isla, y los epitermales de baja sulfuración en vetas de cuarzo (tipo Loma de Jacinto) en el arco volcánico Cretácico. El Anuario Estadístico de Cuba no reporta la cifra de producción de oro.",
    "longitud_km": 400,
    "desde": "Sur de Santa Clara (Villa Clara)",
    "hasta": "Norte de Holguín / Las Tunas"
  },
  "yacimientos": [
    { "id":1,  "nombre":"Moa — Pedro Sotto Alba",            "provincia":"Holguín",           "mineralPrincipal":"Ni-Co",   "tipo":"Laterita (HPAL)",         "reservas":"~870 Mt (P+P NI 43-101 Sherritt)",                 "ley":"1,10 % Ni · 0,10 % Co",    "estado":"suspendido",  "operador":"Moa Nickel S.A. (Sherritt 50 % / CUPN 50 %)",  "valorMillones":27300, "confianza":"alta",       "lat":20.65, "lon":74.95 },
    { "id":2,  "nombre":"Nicaro — Rolo Monterrey",           "provincia":"Holguín",           "mineralPrincipal":"Ni-Co",   "tipo":"Laterita (limonita)",     "reservas":"~600 Mt (estimación histórica GeoMinera)",         "ley":"0,90 % Ni",                 "estado":"suspendido",  "operador":"Empresa de Níquel de Cuba (estatal)",           "valorMillones":null,  "confianza":"media-baja", "lat":20.70, "lon":75.57 },
    { "id":3,  "nombre":"Pinares de Mayarí",                 "provincia":"Holguín",           "mineralPrincipal":"Ni-Co",   "tipo":"Laterita (limonita)",     "reservas":"~2.200 Mt (estimación histórica soviética)",       "ley":"1,00 % Ni · 0,07 % Co",    "estado":"virgen",      "operador":"Sin explotar",                                  "valorMillones":null,  "confianza":"baja",       "lat":20.65, "lon":76.15 },
    { "id":4,  "nombre":"San Felipe",                        "provincia":"Camagüey",          "mineralPrincipal":"Ni-Co",   "tipo":"Laterita (limonita)",     "reservas":"~3.000 Mt (recurso inferido, sin auditoría)",      "ley":"0,90 % Ni · 0,09 % Co",    "estado":"virgen",      "operador":"Sin explotar",                                  "valorMillones":60000, "confianza":"baja",       "lat":21.65, "lon":77.91 },
    { "id":5,  "nombre":"Castellanos (Minas de Matahambre)", "provincia":"Pinar del Río",     "mineralPrincipal":"Pb-Zn",   "tipo":"SEDEX / skarn",           "reservas":"~3,6 Mt de mineral",                              "ley":"6,6 % Zn · 4,8 % Pb",      "estado":"activo",      "operador":"Geominera Pinar (estatal)",                     "valorMillones":null,  "confianza":"alta",       "lat":22.60, "lon":83.00 },
    { "id":6,  "nombre":"La Demajagua — Delita",             "provincia":"Isla de la Juventud","mineralPrincipal":"Au-Ag",  "tipo":"Epitermal baja sulfur.",  "reservas":"7,7 Mt @ 2,9 g/t Au; 720.000 oz Au equiv. (JORC indicado+inferido)", "ley":"2,9 g/t Au equiv.", "estado":"desarrollo", "operador":"Minera La Victoria (Antilles Gold / GeoMinera JV)", "valorMillones":3450,"confianza":"media-alta",  "lat":21.70, "lon":82.85 },
    { "id":7,  "nombre":"El Cobre",                          "provincia":"Santiago de Cuba",  "mineralPrincipal":"Cu",      "tipo":"Volcanogénico (VMS)",     "reservas":"Agotadas (histórico > 5 Mt Cu extraído ss. XVI-XX)","ley":"—",                        "estado":"histórico",   "operador":"Cerrada",                                       "valorMillones":null,  "confianza":"alta",       "lat":20.10, "lon":75.85 },
    { "id":8,  "nombre":"El Chorrillo — Tasajeras",          "provincia":"Camagüey",          "mineralPrincipal":"Zeolita", "tipo":"Clinoptilolita sedim.",   "reservas":"Producción activa; sin reservas auditadas públicas","ley":"70-80 % clinoptilolita",   "estado":"activo",      "operador":"Empresa de Zeolita de Cuba (estatal)",          "valorMillones":null,  "confianza":"media",      "lat":21.80, "lon":79.80 },
    { "id":9,  "nombre":"Nueva Sabana",                      "provincia":"Ciego de Ávila",    "mineralPrincipal":"Cu-Au",   "tipo":"Pórfido cuprífero",       "reservas":"En exploración avanzada",                          "ley":"~0,3 % Cu equiv. (est.)",   "estado":"construccion","operador":"Consorcio mixto (no divulgado)",                 "valorMillones":null,  "confianza":"baja",       "lat":22.05, "lon":78.75 },
    { "id":10, "nombre":"Charco Redondo",                    "provincia":"Granma",            "mineralPrincipal":"Mn",      "tipo":"Sedimentario marino",     "reservas":"~2 Mt (estimación GeoMinera)",                     "ley":"~35 % Mn",                  "estado":"intermitente","operador":"Geominera Granma (estatal)",                    "valorMillones":null,  "confianza":"media-baja", "lat":20.10, "lon":76.50 },
    { "id":11, "nombre":"Loma de Jacinto (El Limón Nuevo, Beatriz, Sur de Elena)", "provincia":"Camagüey (Guáimaro)", "mineralPrincipal":"Au-Ag", "tipo":"Epitermal baja sulfur., vetas de cuarzo", "reservas":"8 t Au rec. totales (7,6 t M+I); 10 vetas identificadas", "ley":"97,54 % pureza botón; 83,54 % Au · 14 % Ag", "estado":"desarrollo", "operador":"GeoMinera Camagüey (Geominsal)", "valorMillones":1029, "confianza":"alta", "lat":21.75, "lon":76.65 },
    { "id":12, "nombre":"Golden Hill",                       "provincia":"Las Tunas",         "mineralPrincipal":"Au",      "tipo":"Alta sulfuración/vetas",  "reservas":"Activo desde 2011, ~60 kg Au/año exportados",      "ley":"n.d.",                      "estado":"activo",      "operador":"GeoMinera (inversión ALBA)",                    "valorMillones":null,  "confianza":"media",      "lat":20.80, "lon":76.50 },
    { "id":13, "nombre":"Falcón (UEB Placetas)",             "provincia":"Villa Clara",       "mineralPrincipal":"Au",      "tipo":"Listvenita (vetas)",      "reservas":"Activo; producción no publicada",                  "ley":"n.d.",                      "estado":"activo",      "operador":"UEB Producciones Mineras Placetas (estatal)",   "valorMillones":null,  "confianza":"media",      "lat":22.31, "lon":79.65 },
    { "id":14, "nombre":"Lote Grande (Jarahueca)",           "provincia":"Sancti Spíritus",   "mineralPrincipal":"Au",      "tipo":"Vetas cuarzo-auríferas",  "reservas":"~23-30 kg/año; procesa en molinos Placetas",       "ley":"80-88 % pureza (18-22 k)",  "estado":"activo",      "operador":"UEB Producciones Mineras Placetas (estatal)",   "valorMillones":null,  "confianza":"media",      "lat":22.05, "lon":79.52 },
    { "id":15, "nombre":"Campo mineral Aguas Claras-Guajabales", "provincia":"Holguín",      "mineralPrincipal":"Au",      "tipo":"Vetas / placeres (hist.)", "reservas":"Histórico (cerró ~1939); minería artesanal activa","ley":"~0,5 g/t (est.)",           "estado":"intermitente","operador":"Minería artesanal / estatal",                   "valorMillones":null,  "confianza":"media",      "lat":21.05, "lon":76.10 },
    { "id":16, "nombre":"La Holguinera (Sector 27)",         "provincia":"Holguín",           "mineralPrincipal":"Au",      "tipo":"Vetítica / diseminada",   "reservas":"1.062.000 t mena → ~1.494 kg Au (~1,5 t pronóstico)","ley":"~1,4 g/t Au",             "estado":"exploracion", "operador":"GeoMinera Oriente",                             "valorMillones":193,   "confianza":"media",      "lat":20.95, "lon":76.05 },
    { "id":17, "nombre":"Distrito El Oro (cuenca río Bayamo)","provincia":"Granma / Santiago","mineralPrincipal":"Au",      "tipo":"Vetas / placeres",        "reservas":"130 km² · >100 concesiones (1930s)",               "ley":"histórico",                 "estado":"histórico",   "operador":"Cerrado desde la II GM",                        "valorMillones":null,  "confianza":"media",      "lat":20.35, "lon":76.70 },